{
    "matricula": "115.751",
    "cartorio": "2º Ofício do Registro de Imóveis Zona Norte",
    "ordem": "115.751",
    "data_abertura": "02 de outubro de 2014",
    "imovel": {
        "tipo": "UNIDADE AUTÔNOMA DE Nº 3102 DA TORRE B, NÃO AVERBADA, APENAS INCORPORADA, do Edifício Residencial que terá a denominação de EDIFÍCIO NEXT TOWERS, a ser edificado no Lote de terreno próprio sob nº 107 da Quadra 435",
        "endereco": "Rua Iracema Guedes Lins, no bairro Altiplano Cabo Branco",
        "areas": {
            "privativa": 71.9,
            "uso_comum": 55.59,
            "total": 148.42,
            "privativa_acessoria": 20.93,
            "privativa_total": 92.83,
            "coef_proporcionalidade": 0.004
        },
        "composicao": "varanda, sala de estar/jantar, 3 (três) quartos sendo um social , um suíte com varanda e um suíte reversível, wcb social reversível a suíte, cozinha/área de serviço e no pavimento de garagem duas vagas cobertas sendo uma confinada, localizadas no semi-subsolo,"
    },
    "proprietario_inicial": {
        "nome": "Firma FIBRA CONSTRUTORA E INCORPORADORA LTDA",
        "identificador": "CNPJ 08.864.917/0001-46"
    },
    "avaliacoes": [
        {
            "data": "17 de Janeiro de 2025",
            "valor": "R$ 577.393,13"
        }
    ],
    "resumo": "Matrícula nº 115.751 do 2º Ofício do Registro de Imóveis Zona Norte (Ordem 115.751, aberta em 02 de outubro de 2014). Trata-se de unidade autônoma de nº 3102 da torre b, não averbada, apenas incorporada, do edifício residencial que terá a denominação de edifício next towers, a ser edificado no lote de terreno próprio sob nº 107 da quadra 435, localizado em Rua Iracema Guedes Lins, no bairro Altiplano Cabo Branco. Possui área privativa de 71.9 m², área de uso comum de 55.59 m², área total de 148.42 m². O imóvel é composto por varanda, sala de estar/jantar, 3 (três) quartos sendo um social , um suíte com varanda e um suíte reversível, wcb social reversível a suíte, cozinha/área de serviço e no pavimento de garagem duas vagas cobertas sendo uma confinada, localizadas no semi-subsolo,. Proprietário inicial: Firma FIBRA CONSTRUTORA E INCORPORADORA LTDA. O imóvel teve uma avaliação registrada em 17 de Janeiro de 2025, no valor de R$ 577.393,13."
}